{
  "dataset_id": "GT-SYN-DRIFT-007",
  "dataset_name": "Intermittent Drift Detected",
  "dataset_version": "1.0.0",
  "dataset_type": "synthetic",
  "status": "certified",
  "created_by": "miie-benchmark-team",
  "created_at": "2026-07-05T00:00:00Z",
  "description": "Synthetic repository with intermittent drift at windows 3-5 and 7-9. Tests D-01 sensitivity to non-continuous anomalies.",
  "repository_classification": "synthetic",
  "language": "python",
  "commit_count": 200,
  "contributor_count": 5,
  "time_span_days": 365,
  "tags": ["drift", "intermittent", "positive"],
  "provenance": {
    "source": "generated",
    "methodology": "BenchmarkDatasetGenerator with intermittent drift injection",
    "tools": ["miie-benchmark-generator"],
    "parameters": {"drift_magnitude": 0.6, "drift_windows": [3, 4, 5, 7, 8, 9], "drift_pattern": "intermittent"},
    "reproducibility": "Run BenchmarkDatasetGenerator with seed=42, drift_pattern=intermittent"
  },
  "ground_truth": {
    "anomaly_present": true,
    "anomaly_type": "metric-drift",
    "anomaly_severity": "moderate",
    "anomaly_window_start": 3,
    "anomaly_window_end": 9,
    "expected_detector_outputs": {
      "D-01": {"detected": true, "severity": "moderate", "p_value_max": 0.05, "confidence_min": 0.65},
      "D-02": {"detected": false, "severity": "none"},
      "D-03": {"detected": false, "severity": "none"}
    },
    "expected_metric_values": {
      "M-03": {"range": [0.0, 1.0], "trend": "shift", "tolerance": 0.10}
    },
    "expected_scores": {
      "integrity_score_range": [0.3, 0.7],
      "confidence_score_range": [0.5, 0.9]
    }
  },
  "acceptance_criteria": {
    "D-01_sensitivity_min": 0.75,
    "D-01_specificity_min": 0.90,
    "determinism_required": true
  },
  "versioning": {"changelog": ["Initial release"], "compatibility": "backward-compatible"},
  "certification": {"certified_by": "scientific-board", "certified_at": "2026-07-05T00:00:00Z", "criteria": "intermittent-drift-detection-verified", "certificate_id": "CERT-GT-SYN-DRIFT-007-1.0.0"},
  "licensing": {"license": "MIT", "attribution": "MIIE Benchmark Dataset"}
}
