{
  "dataset_id": "GT-SYN-DRIFT-004",
  "dataset_name": "Large Drift Detected",
  "dataset_version": "1.0.0",
  "dataset_type": "synthetic",
  "status": "certified",
  "created_by": "miie-benchmark-team",
  "created_at": "2026-07-05T00:00:00Z",
  "description": "Synthetic repository with large metric drift (d=0.8). D-01 should detect strongly.",
  "repository_classification": "synthetic",
  "language": "python",
  "commit_count": 200,
  "contributor_count": 5,
  "time_span_days": 365,
  "tags": ["drift", "large", "positive"],
  "provenance": {
    "source": "generated",
    "methodology": "BenchmarkDatasetGenerator with large drift injection",
    "tools": ["miie-benchmark-generator"],
    "parameters": {"drift_magnitude": 0.8, "drift_onset": 5, "windows": 10},
    "reproducibility": "Run BenchmarkDatasetGenerator with seed=42, drift_magnitude=0.8"
  },
  "ground_truth": {
    "anomaly_present": true,
    "anomaly_type": "metric-drift",
    "anomaly_severity": "high",
    "anomaly_window_start": 5,
    "anomaly_window_end": 10,
    "expected_detector_outputs": {
      "D-01": {"detected": true, "severity": "high", "p_value_max": 0.01, "confidence_min": 0.8},
      "D-02": {"detected": false, "severity": "none"},
      "D-03": {"detected": false, "severity": "none"}
    },
    "expected_metric_values": {
      "M-01": {"range": [0.0, 1.0], "trend": "stable", "tolerance": 0.05},
      "M-02": {"range": [100, 300], "trend": "stable", "tolerance": 50},
      "M-03": {"range": [0.0, 1.0], "trend": "shift", "tolerance": 0.10},
      "M-07": {"range": [0.0, 1.0], "trend": "stable", "tolerance": 0.10}
    },
    "expected_scores": {
      "integrity_score_range": [0.1, 0.5],
      "confidence_score_range": [0.4, 0.8]
    }
  },
  "acceptance_criteria": {
    "D-01_sensitivity_min": 0.80,
    "D-01_specificity_min": 0.90,
    "metric_computation_tolerance": 0.01,
    "determinism_required": true
  },
  "versioning": {
    "changelog": ["Initial release"],
    "compatibility": "backward-compatible"
  },
  "certification": {
    "certified_by": "scientific-board",
    "certified_at": "2026-07-05T00:00:00Z",
    "criteria": "strong-detection-verified",
    "certificate_id": "CERT-GT-SYN-DRIFT-004-1.0.0"
  },
  "licensing": {
    "license": "MIT",
    "attribution": "MIIE Benchmark Dataset"
  }
}
