{
  "dataset_id": "GT-SYN-CORR-003",
  "dataset_name": "Medium Correlation Weakening Detected",
  "dataset_version": "1.0.0",
  "dataset_type": "synthetic",
  "status": "certified",
  "created_by": "miie-benchmark-team",
  "created_at": "2026-07-05T00:00:00Z",
  "description": "Synthetic repository with medium correlation weakening (Δr=0.3). D-02 should detect via Fisher z-transform.",
  "repository_classification": "synthetic",
  "language": "python",
  "commit_count": 200,
  "contributor_count": 5,
  "time_span_days": 365,
  "tags": ["correlation", "medium", "positive"],
  "provenance": {
    "source": "generated",
    "methodology": "BenchmarkDatasetGenerator with medium correlation weakening",
    "tools": ["miie-benchmark-generator"],
    "parameters": {"correlation_shift": 0.3, "breakdown_window": 5},
    "reproducibility": "Run BenchmarkDatasetGenerator with seed=42, correlation_shift=0.3"
  },
  "ground_truth": {
    "anomaly_present": true,
    "anomaly_type": "correlation-breakdown",
    "anomaly_severity": "moderate",
    "anomaly_window_start": 5,
    "anomaly_window_end": 10,
    "expected_detector_outputs": {
      "D-01": {"detected": false, "severity": "none"},
      "D-02": {"detected": true, "severity": "moderate", "confidence_min": 0.7},
      "D-03": {"detected": false, "severity": "none"}
    },
    "expected_metric_values": {
      "M-01": {"range": [0.0, 1.0], "trend": "stable"},
      "M-03": {"range": [0.0, 1.0], "trend": "stable"}
    },
    "expected_scores": {
      "integrity_score_range": [0.4, 0.7],
      "confidence_score_range": [0.5, 0.9]
    }
  },
  "acceptance_criteria": {
    "D-02_sensitivity_min": 0.75,
    "D-02_specificity_min": 0.85,
    "determinism_required": true
  },
  "versioning": {"changelog": ["Initial release"], "compatibility": "backward-compatible"},
  "certification": {"certified_by": "scientific-board", "certified_at": "2026-07-05T00:00:00Z", "criteria": "correlation-breakdown-detection-verified", "certificate_id": "CERT-GT-SYN-CORR-003-1.0.0"},
  "licensing": {"license": "MIT", "attribution": "MIIE Benchmark Dataset"}
}
